{
  "schema_version": "instrumented-transition-conformance.v1",
  "profile": {
    "subject_id": "urn:delta-atlas:subject:synthetic-instrumented-transition",
    "subject_type": "synthetic-state-machine",
    "policy_id": "urn:delta-atlas:policy:instrumented-transition-candidate",
    "policy_generation": 1
  },
  "state_model": {
    "states": [
      {
        "state_id": "NOMINAL",
        "legal": true,
        "safe": true,
        "essential": true
      },
      {
        "state_id": "DEGRADED",
        "legal": true,
        "safe": true,
        "essential": true
      },
      {
        "state_id": "RECOVERING",
        "legal": true,
        "safe": true,
        "essential": true
      },
      {
        "state_id": "CONTAINED",
        "legal": true,
        "safe": true,
        "essential": false
      },
      {
        "state_id": "LOST",
        "legal": true,
        "safe": false,
        "essential": false
      },
      {
        "state_id": "ILLEGAL",
        "legal": false,
        "safe": false,
        "essential": false
      }
    ],
    "transitions": [
      {
        "transition_id": "control-hold-nominal",
        "from": "NOMINAL",
        "to": "NOMINAL",
        "kind": "CONTROL"
      },
      {
        "transition_id": "control-recover",
        "from": "DEGRADED",
        "to": "RECOVERING",
        "kind": "CONTROL"
      },
      {
        "transition_id": "control-stabilize",
        "from": "RECOVERING",
        "to": "NOMINAL",
        "kind": "CONTROL"
      },
      {
        "transition_id": "disturb-friction",
        "from": "NOMINAL",
        "to": "DEGRADED",
        "kind": "DISTURBANCE"
      },
      {
        "transition_id": "disturb-escalate",
        "from": "DEGRADED",
        "to": "LOST",
        "kind": "DISTURBANCE"
      },
      {
        "transition_id": "instrument-null-click",
        "from": "NOMINAL",
        "to": "NOMINAL",
        "kind": "INSTRUMENT",
        "instrument_id": "urn:delta-atlas:instrument:null-click"
      },
      {
        "transition_id": "instrument-invasiveness",
        "from": "NOMINAL",
        "to": "DEGRADED",
        "kind": "INSTRUMENT",
        "instrument_id": "urn:delta-atlas:instrument:invasive-probe"
      },
      {
        "transition_id": "instrument-invasiveness-commit",
        "from": "NOMINAL",
        "to": "NOMINAL",
        "kind": "INSTRUMENT",
        "instrument_id": "urn:delta-atlas:instrument:invasive-probe"
      }
    ]
  },
  "instrument_profiles": [
    {
      "schema_version": "instrument-profile.v1",
      "instrument_id": "urn:delta-atlas:instrument:null-click",
      "instrument_version": 1,
      "subject_type": "synthetic-state-machine",
      "allowed_states": [
        "NOMINAL",
        "DEGRADED"
      ],
      "input_schema_ref": "https://delta-atlas.example/schemas/synthetic-click-input.v1.json",
      "state_read_set": [
        "ui.state"
      ],
      "state_write_set": [
        "ui.last-invocation"
      ],
      "effect_footprint": [
        "synthetic.request"
      ],
      "sensing_effect_footprint": [],
      "consequence_class": "REVERSIBLE",
      "authority_required": true,
      "measurement": {
        "procedure_ref": "https://delta-atlas.example/procedures/synthetic-response.v1",
        "measurand_id": "synthetic.response",
        "result_schema_ref": "https://delta-atlas.example/schemas/synthetic-response.v1.json",
        "unit": "event",
        "resolution": 1,
        "dead_band": 0,
        "detection_limit": 1,
        "response_window_steps": 3,
        "operating_conditions": [
          "fixture-only"
        ],
        "calibration_ref": "urn:delta-atlas:calibration:synthetic-null-click-v1",
        "domain_null_allowed": true
      },
      "resource_bound": {
        "irreversibility": 1,
        "invasiveness": 0,
        "external_tool_calls": 0,
        "local_tool_calls": 1,
        "bytes_read": 64,
        "egress_bytes": 0,
        "token_ceiling": 0,
        "wall_time_ms": 10
      },
      "privacy": {
        "access_class": "OWNER_PRIVATE",
        "egress_allowed": false,
        "max_egress_bytes": 0
      }
    },
    {
      "schema_version": "instrument-profile.v1",
      "instrument_id": "urn:delta-atlas:instrument:invasive-probe",
      "instrument_version": 1,
      "subject_type": "synthetic-state-machine",
      "allowed_states": [
        "NOMINAL",
        "DEGRADED"
      ],
      "input_schema_ref": "https://delta-atlas.example/schemas/synthetic-probe-input.v1.json",
      "state_read_set": [
        "system.signal"
      ],
      "state_write_set": [
        "system.probe-count"
      ],
      "effect_footprint": [
        "synthetic.probe"
      ],
      "sensing_effect_footprint": [
        "system.temperature"
      ],
      "consequence_class": "COMPENSATABLE",
      "authority_required": true,
      "measurement": {
        "procedure_ref": "https://delta-atlas.example/procedures/synthetic-invasive-probe.v1",
        "measurand_id": "system.signal",
        "result_schema_ref": "https://delta-atlas.example/schemas/synthetic-signal.v1.json",
        "unit": "signal-unit",
        "resolution": 0.1,
        "dead_band": 0.05,
        "detection_limit": 0.2,
        "response_window_steps": 2,
        "operating_conditions": [
          "fixture-only",
          "temperature-bounded"
        ],
        "calibration_ref": "urn:delta-atlas:calibration:synthetic-invasive-probe-v1",
        "domain_null_allowed": false
      },
      "resource_bound": {
        "irreversibility": 2,
        "invasiveness": 3,
        "external_tool_calls": 1,
        "local_tool_calls": 1,
        "bytes_read": 2048,
        "egress_bytes": 0,
        "token_ceiling": 0,
        "wall_time_ms": 1000
      },
      "privacy": {
        "access_class": "OWNER_PRIVATE",
        "egress_allowed": false,
        "max_egress_bytes": 0
      }
    },
    {
      "schema_version": "instrument-profile.v1",
      "instrument_id": "urn:delta-atlas:instrument:local-schema-check",
      "instrument_version": 1,
      "subject_type": "synthetic-state-machine",
      "allowed_states": [
        "NOMINAL",
        "DEGRADED",
        "RECOVERING"
      ],
      "input_schema_ref": "https://delta-atlas.example/schemas/local-schema-check-input.v1.json",
      "state_read_set": [
        "artifact.schema"
      ],
      "state_write_set": [],
      "effect_footprint": [],
      "sensing_effect_footprint": [],
      "consequence_class": "READ_ONLY",
      "authority_required": false,
      "measurement": {
        "procedure_ref": "https://delta-atlas.example/procedures/local-schema-validation.v1",
        "measurand_id": "schema.conformance",
        "result_schema_ref": "https://delta-atlas.example/schemas/check-result.v1.json",
        "unit": "predicate",
        "resolution": null,
        "dead_band": null,
        "detection_limit": null,
        "response_window_steps": 1,
        "operating_conditions": [
          "local-bytes-available"
        ],
        "calibration_ref": "urn:delta-atlas:calibration:ajv-8.20.0",
        "domain_null_allowed": false
      },
      "resource_bound": {
        "irreversibility": 0,
        "invasiveness": 0,
        "external_tool_calls": 0,
        "local_tool_calls": 1,
        "bytes_read": 4096,
        "egress_bytes": 0,
        "token_ceiling": 0,
        "wall_time_ms": 100
      },
      "privacy": {
        "access_class": "OWNER_PRIVATE",
        "egress_allowed": false,
        "max_egress_bytes": 0
      }
    },
    {
      "schema_version": "instrument-profile.v1",
      "instrument_id": "urn:delta-atlas:instrument:remote-schema-probe",
      "instrument_version": 1,
      "subject_type": "synthetic-state-machine",
      "allowed_states": [
        "NOMINAL",
        "DEGRADED"
      ],
      "input_schema_ref": "https://delta-atlas.example/schemas/remote-schema-probe-input.v1.json",
      "state_read_set": [
        "artifact.schema"
      ],
      "state_write_set": [],
      "effect_footprint": [
        "remote.request"
      ],
      "sensing_effect_footprint": [],
      "consequence_class": "REVERSIBLE",
      "authority_required": true,
      "measurement": {
        "procedure_ref": "https://delta-atlas.example/procedures/remote-schema-validation.v1",
        "measurand_id": "schema.conformance",
        "result_schema_ref": "https://delta-atlas.example/schemas/check-result.v1.json",
        "unit": "predicate",
        "resolution": null,
        "dead_band": null,
        "detection_limit": null,
        "response_window_steps": 10,
        "operating_conditions": [
          "network-available",
          "egress-authorized"
        ],
        "calibration_ref": "urn:delta-atlas:calibration:remote-schema-probe-v1",
        "domain_null_allowed": false
      },
      "resource_bound": {
        "irreversibility": 1,
        "invasiveness": 1,
        "external_tool_calls": 1,
        "local_tool_calls": 0,
        "bytes_read": 4096,
        "egress_bytes": 4096,
        "token_ceiling": 512,
        "wall_time_ms": 5000
      },
      "privacy": {
        "access_class": "OWNER_PRIVATE",
        "egress_allowed": true,
        "max_egress_bytes": 4096
      }
    },
    {
      "schema_version": "instrument-profile.v1",
      "instrument_id": "urn:delta-atlas:instrument:wrong-subject-check",
      "instrument_version": 1,
      "subject_type": "different-synthetic-state-machine",
      "allowed_states": [
        "NOMINAL",
        "DEGRADED",
        "RECOVERING"
      ],
      "input_schema_ref": "https://delta-atlas.example/schemas/local-schema-check-input.v1.json",
      "state_read_set": [
        "artifact.schema"
      ],
      "state_write_set": [],
      "effect_footprint": [],
      "sensing_effect_footprint": [],
      "consequence_class": "READ_ONLY",
      "authority_required": false,
      "measurement": {